{
  "$schema": "./schemas/missing-word.schema.json",
  "game": "missing-word",
  "version": 1,
  "displayName": "Missing Word",
  "roundsPerSession": 10,
  "sessions": [
    {
      "id": "mw-session-001",
      "title": "Missing Word Pack 001",
      "theme": "KJV missing-word verses",
      "rounds": [
        {
          "id": "mw-r001",
          "reference": "Genesis 1:1",
          "sourceTranslation": "KJV",
          "theme": "Creation",
          "verseText": "In the beginning God created the heaven and the earth.",
          "missingWords": [
            "God"
          ],
          "acceptedAnswers": [
            "God"
          ],
          "difficulty": "easy",
          "teachingNote": "Review Genesis 1:1 and the full verse before continuing."
        },
        {
          "id": "mw-r002",
          "reference": "Psalm 23:1",
          "sourceTranslation": "KJV",
          "theme": "Provision",
          "verseText": "The LORD is my shepherd; I shall not want.",
          "missingWords": [
            "LORD"
          ],
          "acceptedAnswers": [
            "LORD",
            "Lord"
          ],
          "difficulty": "medium",
          "teachingNote": "Review Psalm 23:1 and the full verse before continuing."
        },
        {
          "id": "mw-r003",
          "reference": "Psalm 119:105",
          "sourceTranslation": "KJV",
          "theme": "Guidance",
          "verseText": "Thy word is a lamp unto my feet, and a light unto my path.",
          "missingWords": [
            "lamp"
          ],
          "acceptedAnswers": [
            "lamp"
          ],
          "difficulty": "hard",
          "teachingNote": "Review Psalm 119:105 and the full verse before continuing."
        },
        {
          "id": "mw-r004",
          "reference": "Proverbs 3:5",
          "sourceTranslation": "KJV",
          "theme": "Trust",
          "verseText": "Trust in the LORD with all thine heart; and lean not unto thine own understanding.",
          "missingWords": [
            "heart"
          ],
          "acceptedAnswers": [
            "heart"
          ],
          "difficulty": "easy",
          "teachingNote": "Review Proverbs 3:5 and the full verse before continuing."
        },
        {
          "id": "mw-r005",
          "reference": "Isaiah 40:31",
          "sourceTranslation": "KJV",
          "theme": "Strength",
          "verseText": "But they that wait upon the LORD shall renew their strength; they shall mount up with wings as eagles;",
          "missingWords": [
            "renew",
            "strength"
          ],
          "acceptedAnswers": [
            "renew strength"
          ],
          "difficulty": "medium",
          "teachingNote": "Review Isaiah 40:31 and the full verse before continuing."
        },
        {
          "id": "mw-r006",
          "reference": "Matthew 5:9",
          "sourceTranslation": "KJV",
          "theme": "Peace",
          "verseText": "Blessed are the peacemakers: for they shall be called the children of God.",
          "missingWords": [
            "peacemakers"
          ],
          "acceptedAnswers": [
            "peacemakers"
          ],
          "difficulty": "hard",
          "teachingNote": "Review Matthew 5:9 and the full verse before continuing."
        },
        {
          "id": "mw-r007",
          "reference": "Matthew 6:21",
          "sourceTranslation": "KJV",
          "theme": "Treasure",
          "verseText": "For where your treasure is, there will your heart be also.",
          "missingWords": [
            "treasure",
            "heart"
          ],
          "acceptedAnswers": [
            "treasure heart"
          ],
          "difficulty": "easy",
          "teachingNote": "Review Matthew 6:21 and the full verse before continuing."
        },
        {
          "id": "mw-r008",
          "reference": "Matthew 11:28",
          "sourceTranslation": "KJV",
          "theme": "Rest",
          "verseText": "Come unto me, all ye that labour and are heavy laden, and I will give you rest.",
          "missingWords": [
            "rest"
          ],
          "acceptedAnswers": [
            "rest"
          ],
          "difficulty": "medium",
          "teachingNote": "Review Matthew 11:28 and the full verse before continuing."
        },
        {
          "id": "mw-r009",
          "reference": "Luke 2:11",
          "sourceTranslation": "KJV",
          "theme": "Birth of Jesus",
          "verseText": "For unto you is born this day in the city of David a Saviour, which is Christ the Lord.",
          "missingWords": [
            "Saviour"
          ],
          "acceptedAnswers": [
            "Saviour",
            "Savior"
          ],
          "difficulty": "hard",
          "teachingNote": "Review Luke 2:11 and the full verse before continuing."
        },
        {
          "id": "mw-r010",
          "reference": "John 1:1",
          "sourceTranslation": "KJV",
          "theme": "The Word",
          "verseText": "In the beginning was the Word, and the Word was with God, and the Word was God.",
          "missingWords": [
            "Word"
          ],
          "acceptedAnswers": [
            "Word"
          ],
          "difficulty": "easy",
          "teachingNote": "Review John 1:1 and the full verse before continuing."
        }
      ]
    },
    {
      "id": "mw-session-002",
      "title": "Missing Word Pack 002",
      "theme": "KJV missing-word verses",
      "rounds": [
        {
          "id": "mw-r011",
          "reference": "John 3:16",
          "sourceTranslation": "KJV",
          "theme": "Salvation",
          "verseText": "For God so loved the world, that he gave his only begotten Son, that whosoever believeth in him should not perish, but have everlasting life.",
          "missingWords": [
            "only",
            "begotten",
            "Son"
          ],
          "acceptedAnswers": [
            "only begotten Son",
            "only begotten son"
          ],
          "difficulty": "medium",
          "teachingNote": "Review John 3:16 and the full verse before continuing."
        },
        {
          "id": "mw-r012",
          "reference": "John 11:35",
          "sourceTranslation": "KJV",
          "theme": "Compassion",
          "verseText": "Jesus wept.",
          "missingWords": [
            "wept"
          ],
          "acceptedAnswers": [
            "wept"
          ],
          "difficulty": "hard",
          "teachingNote": "Review John 11:35 and the full verse before continuing."
        },
        {
          "id": "mw-r013",
          "reference": "John 14:6",
          "sourceTranslation": "KJV",
          "theme": "Jesus",
          "verseText": "Jesus saith unto him, I am the way, the truth, and the life:",
          "missingWords": [
            "way",
            "truth",
            "life"
          ],
          "acceptedAnswers": [
            "way truth life",
            "the way the truth the life"
          ],
          "difficulty": "easy",
          "teachingNote": "Review John 14:6 and the full verse before continuing."
        },
        {
          "id": "mw-r014",
          "reference": "Romans 3:23",
          "sourceTranslation": "KJV",
          "theme": "Sin",
          "verseText": "For all have sinned, and come short of the glory of God;",
          "missingWords": [
            "sinned"
          ],
          "acceptedAnswers": [
            "sinned"
          ],
          "difficulty": "medium",
          "teachingNote": "Review Romans 3:23 and the full verse before continuing."
        },
        {
          "id": "mw-r015",
          "reference": "Romans 6:23",
          "sourceTranslation": "KJV",
          "theme": "Gift of God",
          "verseText": "For the wages of sin is death; but the gift of God is eternal life through Jesus Christ our Lord.",
          "missingWords": [
            "eternal",
            "life"
          ],
          "acceptedAnswers": [
            "eternal life"
          ],
          "difficulty": "hard",
          "teachingNote": "Review Romans 6:23 and the full verse before continuing."
        },
        {
          "id": "mw-r016",
          "reference": "Ephesians 2:8",
          "sourceTranslation": "KJV",
          "theme": "Grace",
          "verseText": "For by grace are ye saved through faith; and that not of yourselves: it is the gift of God:",
          "missingWords": [
            "grace"
          ],
          "acceptedAnswers": [
            "grace"
          ],
          "difficulty": "easy",
          "teachingNote": "Review Ephesians 2:8 and the full verse before continuing."
        },
        {
          "id": "mw-r017",
          "reference": "Philippians 4:13",
          "sourceTranslation": "KJV",
          "theme": "Strength",
          "verseText": "I can do all things through Christ which strengtheneth me.",
          "missingWords": [
            "Christ"
          ],
          "acceptedAnswers": [
            "Christ"
          ],
          "difficulty": "medium",
          "teachingNote": "Review Philippians 4:13 and the full verse before continuing."
        },
        {
          "id": "mw-r018",
          "reference": "Hebrews 11:1",
          "sourceTranslation": "KJV",
          "theme": "Faith",
          "verseText": "Now faith is the substance of things hoped for, the evidence of things not seen.",
          "missingWords": [
            "faith"
          ],
          "acceptedAnswers": [
            "faith"
          ],
          "difficulty": "hard",
          "teachingNote": "Review Hebrews 11:1 and the full verse before continuing."
        },
        {
          "id": "mw-r019",
          "reference": "James 1:5",
          "sourceTranslation": "KJV",
          "theme": "Wisdom",
          "verseText": "If any of you lack wisdom, let him ask of God, that giveth to all men liberally,",